[
  {
    "id": "pick-and-roll-central",
    "cat": "attaque",
    "family": "pick-and-roll",
    "lvl": 1,
    "name": {
      "fr": "Pick-and-roll central",
      "en": "High pick-and-roll"
    },
    "status": "done"
  },
  {
    "id": "side-pick-and-roll",
    "cat": "attaque",
    "family": "pick-and-roll",
    "lvl": 1,
    "name": {
      "fr": "Pick-and-roll latéral",
      "en": "Side pick-and-roll"
    },
    "status": "done"
  },
  {
    "id": "spain-pick-and-roll",
    "cat": "attaque",
    "family": "pick-and-roll",
    "lvl": 3,
    "name": {
      "fr": "Pick-and-roll « Spain » (écran dans le dos du défenseur du pivot)",
      "en": "Spain pick-and-roll"
    },
    "status": "done"
  },
  {
    "id": "step-up-screen",
    "cat": "attaque",
    "family": "pick-and-roll",
    "lvl": 2,
    "name": {
      "fr": "Écran de remontée (step-up)",
      "en": "Step-up screen"
    },
    "status": "done"
  },
  {
    "id": "re-screen-flip",
    "cat": "attaque",
    "family": "pick-and-roll",
    "lvl": 2,
    "name": {
      "fr": "Double écran porteur (re-screen)",
      "en": "Re-screen (flip)"
    },
    "status": "done"
  },
  {
    "id": "slip-screen",
    "cat": "attaque",
    "family": "pick-and-roll",
    "lvl": 2,
    "name": {
      "fr": "Écran glissé (slip)",
      "en": "Slip screen"
    },
    "status": "done"
  },
  {
    "id": "pick-and-pop",
    "cat": "attaque",
    "family": "pick-and-roll",
    "lvl": 1,
    "name": {
      "fr": "Pick-and-pop",
      "en": "Pick-and-pop"
    },
    "status": "done"
  },
  {
    "id": "short-roll",
    "cat": "attaque",
    "family": "pick-and-roll",
    "lvl": 2,
    "name": {
      "fr": "Roll court (short roll)",
      "en": "Short roll"
    },
    "status": "done"
  },
  {
    "id": "ghost-screen",
    "cat": "attaque",
    "family": "pick-and-roll",
    "lvl": 3,
    "name": {
      "fr": "Écran fantôme (ghost screen)",
      "en": "Ghost screen"
    },
    "status": "done"
  },
  {
    "id": "snake-dribble",
    "cat": "attaque",
    "family": "pick-and-roll",
    "lvl": 3,
    "name": {
      "fr": "Dribble serpent (snake)",
      "en": "Snake dribble"
    },
    "status": "done"
  },
  {
    "id": "reject-the-screen",
    "cat": "attaque",
    "family": "pick-and-roll",
    "lvl": 2,
    "name": {
      "fr": "Refuser l'écran (reject)",
      "en": "Reject the screen"
    },
    "status": "done"
  },
  {
    "id": "empty-side-pick-and-roll",
    "cat": "attaque",
    "family": "pick-and-roll",
    "lvl": 2,
    "name": {
      "fr": "Pick-and-roll côté vide",
      "en": "Empty-side pick-and-roll"
    },
    "status": "done"
  },
  {
    "id": "angle-pick-and-roll",
    "cat": "attaque",
    "family": "pick-and-roll",
    "lvl": 2,
    "name": {
      "fr": "Pick-and-roll en angle",
      "en": "Angle pick-and-roll"
    },
    "status": "done"
  },
  {
    "id": "pick-and-roll-with-corner-lift",
    "cat": "attaque",
    "family": "pick-and-roll",
    "lvl": 2,
    "name": {
      "fr": "Pick-and-roll avec remontée du corner (lift)",
      "en": "Pick-and-roll with corner lift"
    },
    "status": "done"
  },
  {
    "id": "pick-and-roll-with-weak-side-shake",
    "cat": "attaque",
    "family": "pick-and-roll",
    "lvl": 3,
    "name": {
      "fr": "Pick-and-roll avec glissement côté faible (shake)",
      "en": "Pick-and-roll with weak-side shake"
    },
    "status": "done"
  },
  {
    "id": "inverted-pick-and-roll",
    "cat": "attaque",
    "family": "pick-and-roll",
    "lvl": 3,
    "name": {
      "fr": "Pick-and-roll inversé (le meneur pose l'écran)",
      "en": "Inverted pick-and-roll"
    },
    "status": "done"
  },
  {
    "id": "stack-pick-and-roll",
    "cat": "attaque",
    "family": "pick-and-roll",
    "lvl": 3,
    "name": {
      "fr": "Pick-and-roll en colonne (stack)",
      "en": "Stack pick-and-roll"
    },
    "status": "done"
  },
  {
    "id": "veer-screen",
    "cat": "attaque",
    "family": "pick-and-roll",
    "lvl": 3,
    "name": {
      "fr": "Écran en biais (veer)",
      "en": "Veer screen"
    },
    "status": "done"
  },
  {
    "id": "hostage-dribble",
    "cat": "attaque",
    "family": "pick-and-roll",
    "lvl": 2,
    "name": {
      "fr": "Dribble « otage » (garder le défenseur dans le dos)",
      "en": "Hostage dribble"
    },
    "status": "done"
  },
  {
    "id": "split-the-hedge",
    "cat": "attaque",
    "family": "pick-and-roll",
    "lvl": 2,
    "name": {
      "fr": "Passer entre les deux défenseurs (split)",
      "en": "Split the hedge"
    },
    "status": "done"
  },
  {
    "id": "pull-up-vs-drop-coverage",
    "cat": "attaque",
    "family": "pick-and-roll",
    "lvl": 2,
    "name": {
      "fr": "Pick-and-roll contre défense reculée : tir en sortie de dribble",
      "en": "Pull-up vs drop coverage"
    },
    "status": "done"
  },
  {
    "id": "seal-the-switch",
    "cat": "attaque",
    "family": "pick-and-roll",
    "lvl": 2,
    "name": {
      "fr": "Pick-and-roll contre changement : sceller le petit",
      "en": "Seal the switch"
    },
    "status": "done"
  },
  {
    "id": "high-pick-and-roll-vs-stunt",
    "cat": "attaque",
    "family": "pick-and-roll",
    "lvl": 3,
    "name": {
      "fr": "Pick-and-roll central avec feinte d'aide (stunt)",
      "en": "High pick-and-roll vs stunt"
    },
    "status": "done"
  },
  {
    "id": "single-drag-screen",
    "cat": "attaque",
    "family": "pick-and-roll",
    "lvl": 1,
    "name": {
      "fr": "Pick-and-roll en transition (drag simple)",
      "en": "Single drag screen"
    },
    "status": "done"
  },
  {
    "id": "21-series",
    "cat": "attaque",
    "family": "pick-and-roll",
    "lvl": 3,
    "name": {
      "fr": "Pick-and-roll « 21 » (passe à l'aile, coupe, écran)",
      "en": "21 series"
    },
    "status": "done"
  },
  {
    "id": "wing-wing-pick-and-roll",
    "cat": "attaque",
    "family": "pick-and-roll",
    "lvl": 2,
    "name": {
      "fr": "Pick-and-roll 3-4 (deux ailiers)",
      "en": "Wing-wing pick-and-roll"
    },
    "status": "done"
  },
  {
    "id": "rub-pick-and-roll",
    "cat": "attaque",
    "family": "pick-and-roll",
    "lvl": 3,
    "name": {
      "fr": "Pick-and-roll « Rub » (le pivot frotte puis repose l'écran)",
      "en": "Rub pick-and-roll"
    },
    "status": "done"
  },
  {
    "id": "flat-ball-screen",
    "cat": "attaque",
    "family": "pick-and-roll",
    "lvl": 2,
    "name": {
      "fr": "Écran porteur à plat (flat)",
      "en": "Flat ball screen"
    },
    "status": "done"
  },
  {
    "id": "baseline-ball-screen",
    "cat": "attaque",
    "family": "pick-and-roll",
    "lvl": 3,
    "name": {
      "fr": "Écran porteur à la ligne de fond",
      "en": "Baseline ball screen"
    },
    "status": "done"
  },
  {
    "id": "double-ball-screen",
    "cat": "attaque",
    "family": "pick-and-roll",
    "lvl": 3,
    "name": {
      "fr": "Pick-and-roll avec double écraneur (double ball screen)",
      "en": "Double ball screen"
    },
    "status": "done"
  },
  {
    "id": "horns-flare",
    "cat": "attaque",
    "family": "horns",
    "lvl": 2,
    "name": {
      "fr": "Horns Flare",
      "en": "Horns Flare"
    },
    "status": "done"
  },
  {
    "id": "horns-twist",
    "cat": "attaque",
    "family": "horns",
    "lvl": 3,
    "name": {
      "fr": "Horns Twist",
      "en": "Horns Twist"
    },
    "status": "done"
  },
  {
    "id": "horns-pop",
    "cat": "attaque",
    "family": "horns",
    "lvl": 2,
    "name": {
      "fr": "Horns Pop",
      "en": "Horns Pop"
    },
    "status": "done"
  },
  {
    "id": "horns-pick-and-roll",
    "cat": "attaque",
    "family": "horns",
    "lvl": 1,
    "name": {
      "fr": "Horns pick-and-roll",
      "en": "Horns pick-and-roll"
    },
    "status": "done"
  },
  {
    "id": "horns-rip",
    "cat": "attaque",
    "family": "horns",
    "lvl": 2,
    "name": {
      "fr": "Horns Rip",
      "en": "Horns Rip"
    },
    "status": "done"
  },
  {
    "id": "horns-elbow",
    "cat": "attaque",
    "family": "horns",
    "lvl": 2,
    "name": {
      "fr": "Horns Coude (jeu au coude)",
      "en": "Horns Elbow"
    },
    "status": "done"
  },
  {
    "id": "horns-out",
    "cat": "attaque",
    "family": "horns",
    "lvl": 2,
    "name": {
      "fr": "Horns Out",
      "en": "Horns Out"
    },
    "status": "done"
  },
  {
    "id": "horns-away",
    "cat": "attaque",
    "family": "horns",
    "lvl": 2,
    "name": {
      "fr": "Horns Away",
      "en": "Horns Away"
    },
    "status": "done"
  },
  {
    "id": "horns-down",
    "cat": "attaque",
    "family": "horns",
    "lvl": 2,
    "name": {
      "fr": "Horns Down",
      "en": "Horns Down"
    },
    "status": "done"
  },
  {
    "id": "horns-get",
    "cat": "attaque",
    "family": "horns",
    "lvl": 2,
    "name": {
      "fr": "Horns Get",
      "en": "Horns Get"
    },
    "status": "done"
  },
  {
    "id": "horns-fist",
    "cat": "attaque",
    "family": "horns",
    "lvl": 2,
    "name": {
      "fr": "Horns Fist",
      "en": "Horns Fist"
    },
    "status": "done"
  },
  {
    "id": "horns-iverson",
    "cat": "attaque",
    "family": "horns",
    "lvl": 2,
    "name": {
      "fr": "Horns Iverson",
      "en": "Horns Iverson"
    },
    "status": "done"
  },
  {
    "id": "horns-spain",
    "cat": "attaque",
    "family": "horns",
    "lvl": 3,
    "name": {
      "fr": "Horns Spain",
      "en": "Horns Spain"
    },
    "status": "done"
  },
  {
    "id": "horns-zipper",
    "cat": "attaque",
    "family": "horns",
    "lvl": 2,
    "name": {
      "fr": "Horns Zipper",
      "en": "Horns Zipper"
    },
    "status": "done"
  },
  {
    "id": "horns-chicago",
    "cat": "attaque",
    "family": "horns",
    "lvl": 3,
    "name": {
      "fr": "Horns Chicago",
      "en": "Horns Chicago"
    },
    "status": "done"
  },
  {
    "id": "horns-stagger",
    "cat": "attaque",
    "family": "horns",
    "lvl": 3,
    "name": {